{
  "channel": "<channel>",
  "command": "setup",
  "data": {
    "setup": {
      "backup_paths": [],
      "dry_run": false,
      "enforcement": "warn",
      "installed_files": [],
      "installed_path": "<installed_path>",
      "modified_external_config": null,
      "schema": "agent-rally.command.setup.v1",
      "startup": [
        "rally pi",
        "rally claude",
        "rally codex",
        "rally start <custom-tool>"
      ],
      "tools": [
        {
          "available_on_path": false,
          "startup_command": "rally pi",
          "tool": "pi"
        },
        {
          "available_on_path": false,
          "startup_command": "rally claude",
          "tool": "claude"
        },
        {
          "available_on_path": false,
          "startup_command": "rally codex",
          "tool": "codex"
        },
        {
          "available_on_path": false,
          "startup_command": "rally gemini",
          "tool": "gemini"
        },
        {
          "available_on_path": false,
          "startup_command": "rally cursor",
          "tool": "cursor"
        },
        {
          "available_on_path": false,
          "startup_command": "rally cmux packet --tool <agent>",
          "tool": "cmux"
        },
        {
          "available_on_path": false,
          "startup_command": "rally herdr packet --tool <agent>",
          "tool": "herdr"
        }
      ],
      "verification": []
    }
  },
  "ok": true,
  "schema": "agent-rally.command.setup.v1"
}
